{
  "$schema": "https://agentrig.ai/schema/agentrig-source.json",
  "plugin_path": "plugin",
  "snapshot_created_at": "2026-04-16T09:00:00Z",
  "snapshot_tree_digest": "sha256:ee2c5a69f9d556178149b38c91f9960003bdbf480ececa201fd150771af87b18",
  "submitted_by": "registry-bot@agentrig.ai",
  "upstream_commit": "1111111111111111111111111111111111111111",
  "upstream_repo": "https://github.com/agentrig/core-committer",
  "upstream_tag": "v0.1.0"
}
