{
  "$schema": "https://agentrig.ai/schema/agentrig-source.json",
  "plugin_path": "plugin",
  "snapshot_created_at": "2026-04-15T17:45:00Z",
  "snapshot_tree_digest": "sha256:7f352bdee27e05aabbd2907814335d8fadb22af7d2aff38a42a7f1cfca2b18dd",
  "submitted_by": "community-review@agentrig.ai",
  "upstream_commit": "3333333333333333333333333333333333333333",
  "upstream_repo": "https://github.com/community-agents/typescript-skill",
  "upstream_tag": "v0.1.0"
}
