{
  "$schema": "https://agentrig.ai/schema/agentrig-source.json",
  "plugin_path": "plugin",
  "snapshot_created_at": "2026-05-02T12:00:00Z",
  "snapshot_tree_digest": "sha256:bc4cab3e2a546413b36a2c7054e5c352f1c4239f7f8273b582ebe6b422b706dc",
  "submitted_by": "registry-bot@agentrig.ai",
  "upstream_commit": "3333333333333333333333333333333333333333",
  "upstream_repo": "https://github.com/agentrig/agentrig-registry",
  "upstream_tag": "agentrig.core-v0.1.0"
}
