{
  "$schema": "https://agentrig.ai/schema/agentrig-source.json",
  "artifact_kind": "mcp",
  "artifact_path": ".mcp.json",
  "snapshot_created_at": "2026-04-26T07:30:00Z",
  "snapshot_tree_digest": "sha256:e6e779708a26cb0afda29c91af92290b7667e10e1fc2693cff0e1c18ca45a6a1",
  "submitted_by": "registry-bot@agentrig.ai",
  "upstream_commit": "6b9dc10f9a5c005ade4a373c6a94d0f46bc4fd43",
  "upstream_repo": "https://github.com/regenrek/agentrig-test-plugin",
  "upstream_tag": "v0.2.0"
}
