{
  "$schema": "https://agentrig.ai/schema/agentrig-source.json",
  "plugin_path": ".",
  "snapshot_created_at": "2026-04-26T07:30:00Z",
  "snapshot_tree_digest": "sha256:00cd5671013d280dd97d638f6c9d064f133c6d904b0641d9ae69e115c7d0e203",
  "submitted_by": "registry-bot@agentrig.ai",
  "upstream_commit": "6b9dc10f9a5c005ade4a373c6a94d0f46bc4fd43",
  "upstream_repo": "https://github.com/regenrek/agentrig-test-plugin",
  "upstream_tag": "v0.2.0"
}
